{
  "$schema": "../../docs/schemas/page.schema.json",
  "layout": "page.njk",
  "permalink": "/services/",
  "nav": "services",
  "headerStyle": "light",
  "title": "Services",
  "seo": { "description": "Residential and commercial interior design, bespoke joinery, renovation, lighting design and 3D visualisation — from Woodex Interior, Lahore." },
  "sections": [
    { "type": "page-hero", "id": "hero", "data": { "eyebrow": "Services", "title": "Everything between the first sketch and the last cushion", "text": "Six services, one team. Combine them or start with the one you need.", "image": "service-2.jpg", "breadcrumbs": [{ "label": "Home", "url": "/" }, { "label": "Services" }] } },
    { "type": "services-list", "id": "content", "theme": "light", "data": { "eyebrow": "What we offer", "title": "Our services", "source": "services" } },
    { "type": "process", "id": "process", "theme": "dark", "data": { "eyebrow": "Process", "title": "How a project runs", "text": "Clear stages, clear deliverables, and a decision point at the end of each.", "steps": [ { "title": "Discovery", "text": "We visit the site, agree the brief and budget, and confirm the programme.", "duration": "1–2 weeks" }, { "title": "Concept", "text": "Layout options, mood boards and a first material palette for your approval.", "duration": "2–3 weeks" }, { "title": "Design development", "text": "Detailed drawings, joinery, lighting, finishes schedule and renders.", "duration": "4–6 weeks" }, { "title": "Delivery", "text": "Workshop production, site coordination, styling and handover.", "duration": "8–16 weeks" } ] } },
    { "type": "pricing", "id": "pricing", "theme": "light", "data": { "eyebrow": "Engagement", "title": "Three ways to start", "text": "Fees are fixed per stage and confirmed in writing before we begin.", "note": "All packages include a written scope, itemised allowances and a named project lead. *Prices exclude construction and furniture.*", "plans": [ { "name": "Consultation", "price": "PKR 45,000", "period": "per session", "text": "A two-hour on-site session with a written summary of recommendations.", "features": ["Layout and palette advice", "Lighting quick-wins", "Prioritised shopping list", "Written summary within 3 days"] }, { "name": "Design package", "price": "From PKR 950 / ft²", "text": "Complete design and documentation for a room, floor or whole home.", "features": ["Concept and mood", "Plans, elevations and joinery details", "Lighting and finishes schedules", "Two rounds of revisions", "3D renders of key views"], "highlighted": true, "badge": "Most popular" }, { "name": "Turnkey", "price": "Custom", "text": "Design, build, joinery and styling delivered by one accountable team.", "features": ["Everything in Design package", "Fixed-scope build quotation", "Workshop joinery & installation", "Weekly site reports", "Styled handover"] } ] } },
    { "type": "faq", "id": "faq", "theme": "beige", "data": { "eyebrow": "FAQ", "title": "Questions we hear most", "openFirst": true, "items": [ { "q": "How early should we involve you?", "a": "Before walls move. The best results — and the lowest costs — come when interiors, lighting and joinery are planned alongside the architecture." }, { "q": "Can you work with our contractor?", "a": "Yes. We supply drawings detailed enough for any competent contractor and supervise their work, or deliver turnkey with our own team." }, { "q": "Do you take joinery-only commissions?", "a": "We do — architects and designers commission kitchens, wardrobes and furniture from their own drawings." }, { "q": "What does a typical residential timeline look like?", "a": "Around 10–20 weeks from concept to handover depending on scope. Renovations with structural work run longer." }, { "q": "Do you work outside Lahore?", "a": "Across Pakistan for design and turnkey, and internationally for design and visualisation packages." } ] } },
    { "type": "cta", "data": { "eyebrow": "Not sure where to start?", "title": "Book a free 30-minute call", "buttons": [ { "label": "Get in touch", "url": "/contact/", "style": "white" } ] } }
  ]
}
