{
  "$schema": "../../docs/schemas/page.schema.json",
  "layout": "page.njk",
  "permalink": "/about/",
  "nav": "about",
  "headerStyle": "light",
  "title": "About the studio",
  "seo": { "description": "Woodex Interior is a Lahore design studio and joinery workshop. Meet the team, our values and the way we work." },
  "sections": [
    { "type": "page-hero", "id": "hero", "data": { "eyebrow": "About", "title": "A design studio with a workshop at its heart", "text": "Founded in Lahore in 2014, Woodex Interior brings interior design and bespoke joinery under one roof.", "image": "workshop-1.jpg", "breadcrumbs": [{ "label": "Home", "url": "/" }, { "label": "About" }] } },
    { "type": "intro-split", "id": "content", "theme": "light", "data": { "eyebrow": "Our story", "title": "From a joinery bench to full interiors", "text": "Woodex began as a small workshop making kitchens for architects. Clients kept asking us to design the rooms around them — so we hired designers, and never stopped building.\n\nToday we're a team of designers, makers and project leads delivering homes, hospitality and workplaces across Pakistan, still measuring success by how a space feels ten years on.", "image": "team-1.jpg", "alt": "Amina Raza, founder of Woodex Interior, in the studio material library", "imagePosition": "right", "signature": "Amina Raza, Founder" } },
    { "type": "stats", "theme": "light", "spacing": "tight", "data": { "items": [ { "value": 120, "suffix": "+", "label": "Projects completed" }, { "value": 12, "label": "Years of practice" }, { "value": 18, "label": "Designers & makers" }, { "value": 96, "suffix": "%", "label": "Clients who return or refer" } ] } },
    { "type": "image-strip", "spacing": "tight", "data": { "parallax": true, "images": [ { "src": "workshop-1.jpg", "alt": "The Woodex workshop" }, { "src": "room-1.jpg", "alt": "Living room detail" }, { "src": "portfolio-2.jpg", "alt": "Loft joinery" } ] } },
    { "type": "values", "theme": "dark", "data": { "eyebrow": "Values", "title": "What we hold ourselves to", "columns": 3, "items": [ { "icon": "interior", "title": "Calm over clever", "text": "We resist trends and design for the way a space feels day to day." }, { "icon": "joinery", "title": "Make it properly", "text": "If we can't build it well, we don't draw it." }, { "icon": "plan", "title": "Decide on paper", "text": "Detailed documentation so choices happen before the site does." }, { "icon": "consult", "title": "Say the number", "text": "Transparent pricing with itemised allowances." }, { "icon": "lighting", "title": "Light first", "text": "Lighting is designed with the plan, not added after." }, { "icon": "cube", "title": "Stay accountable", "text": "One team, one site lead, one phone number." } ] } },
    { "type": "team", "theme": "light", "data": { "eyebrow": "The team", "title": "People you'll actually work with", "source": "team", "columns": 3 } },
    { "type": "process", "theme": "beige", "data": { "eyebrow": "How we work", "title": "Four stages, one team", "steps": [ { "title": "Discovery", "text": "Site visit, brief, budget and timeline alignment.", "duration": "1–2 weeks" }, { "title": "Concept", "text": "Layouts, mood and a first material palette.", "duration": "2–3 weeks" }, { "title": "Design development", "text": "Elevations, joinery, lighting and finishes in detail.", "duration": "4–6 weeks" }, { "title": "Delivery", "text": "Workshop, site coordination, styling and handover.", "duration": "8–16 weeks" } ] } },
    { "type": "testimonials", "theme": "light", "data": { "eyebrow": "Client words", "title": "In their words", "items": [ { "quote": "They listened more than they talked, and the house shows it.", "name": "Sara & Omar H.", "role": "Canal-side residence", "rating": 5 }, { "quote": "The most organised site I've ever had. Weekly reports, no surprises.", "name": "Bilal S.", "role": "Meridian workplace", "rating": 5 } ] } },
    { "type": "awards", "theme": "gray", "spacing": "tight", "data": { "eyebrow": "Recognition", "title": "Awards & press", "items": [ { "year": "2025", "title": "Residential Interior of the Year — shortlist", "by": "Pakistan Design Awards" }, { "year": "2024", "title": "Best Café Interior", "by": "Hospitality Pakistan" }, { "year": "2024", "title": "Feature: The new Lahore craft studios", "by": "Design Journal" } ] } },
    { "type": "cta", "data": { "eyebrow": "Work with us", "title": "Let's design something that lasts", "buttons": [ { "label": "Get in touch", "url": "/contact/", "style": "white" }, { "label": "See our work", "url": "/portfolio/", "style": "text" } ] } }
  ]
}
