{ "layout": "page.njk", "permalink": "/terms/", "nav": "terms", "headerStyle": "dark", "title": "Terms of use", "seo": {"description": "Terms for using the Woodex Interior website, our content and the indicative pricing shown on it."},
  "sections": [
    {"type": "page-hero", "data": {"eyebrow": "Legal", "title": "Terms of use", "text": "The rules for using this website and how they relate to a commissioned project.", "size": "short", "breadcrumbs": [{"label": "Home", "url": "/"}, {"label": "Terms"}]}},
    {"type": "rich-text", "data": {"body": "_Last updated: 12 September 2026_\n\nThese terms govern your use of woodexinterior.com. By using the site you accept them. Commissions are governed by the written proposal and contract you sign with Woodex Interior, which take precedence over anything here.\n\n## Use of this website\n\nYou may browse and share links to this site freely. You may not scrape, mirror or reproduce its content for commercial purposes, attempt to interfere with its operation, or use the contact forms to send unsolicited marketing.\n\n## Content and intellectual property\n\nAll designs, drawings, renders, photographs and text on this site are the property of Woodex Interior or are used under licence from their owners and photographers. They may not be reproduced, distributed or used as the basis for other work without written permission. Client project images are published with the client's consent and may be withdrawn at their request.\n\n## Proposals, quotations and prices\n\nInformation on this site — including indicative package prices — is for guidance only and does not constitute an offer. Scope, fees, allowances and timelines are confirmed only in a written proposal. Prices are quoted in Pakistani rupees, exclude applicable taxes unless stated, and are valid for the period stated on the proposal.\n\n## Design work and joinery\n\nDesign fees cover the stages described in the proposal. Joinery and construction quotations are based on approved drawings; changes after approval are priced and confirmed in writing before work proceeds. Our joinery carries a five-year workmanship guarantee; hardware and appliances carry their manufacturers' warranties.\n\n## Third-party links\n\nThe site may link to suppliers, manufacturers or social platforms. We are not responsible for the content or privacy practices of those sites.\n\n## Liability\n\nWe make every effort to keep this site accurate and available, but it is provided \"as is\". To the fullest extent permitted by law we accept no liability for loss arising from reliance on its content or from its unavailability. Nothing in these terms limits liability that cannot be limited by law.\n\n## Governing law\n\nThese terms are governed by the laws of Pakistan. Any dispute relating to the website will be subject to the exclusive jurisdiction of the courts of Lahore.\n\n## Contact\n\nWoodex Interior, 12 Gulberg Boulevard, Lahore 54660 · [hello@woodexinterior.com](mailto:hello@woodexinterior.com) · +92 42 3500 0000."}},
    {"type": "cta", "data": {"eyebrow": "Ready when you are", "title": "Let's talk about your project", "text": "A free 30-minute consultation — in the studio, on site or online.", "buttons": [{"label": "Book a consultation", "url": "/contact/", "style": "white"}, {"label": "Privacy policy", "url": "/privacy/", "style": "text"}]}}
  ] }
