{ "layout": "page.njk", "permalink": "/404.html", "nav": "404", "headerStyle": "dark", "title": "Page not found", "noindex": true, "eleventyExcludeFromCollections": true, "seo": {"description": "The page you were looking for has moved or never existed. Find your way back to Woodex Interior."},
  "sections": [
    {"type": "page-hero", "data": {"eyebrow": "404", "title": "This room doesn't exist", "text": "The page may have moved, or the link was mistyped. Here are the doors that do open.", "size": "short"}},
    {"type": "services-list", "theme": "light", "data": {"eyebrow": "Popular pages", "title": "Try one of these", "items": [{"title": "Home", "text": "Start again from the front door.", "url": "/", "tags": ["Studio"]}, {"title": "Services", "text": "Residential and commercial design, joinery, renovation, lighting and visualisation.", "url": "/services/", "tags": ["Six services"]}, {"title": "Portfolio", "text": "Homes, cafés, workplaces and stores — each built from the drawings you'll find in the case studies.", "url": "/portfolio/", "tags": ["Selected work"]}, {"title": "Journal", "text": "Practical writing on design, materials, budgets and the workshop.", "url": "/blog/", "tags": ["Notes"]}, {"title": "Contact", "text": "Tell us about your space and we'll come back within one working day.", "url": "/contact/", "tags": ["Say hello"]}]}},
    {"type": "cta", "data": {"eyebrow": "Still lost?", "title": "Email us and we'll point you the right way", "buttons": [{"label": "hello@woodexinterior.com", "url": "mailto:hello@woodexinterior.com", "style": "white"}]}}
  ] }
